<?xml version="1.0" encoding="UTF-8"?>
<groups xmlns="http://www.isdc.ro/wro"
  xmlns:xsi="http://www.w3.org/2001/XMLSchema-instance"
  xsi:schemaLocation="http://www.isdc.ro/wro wro.xsd">

  <group name="g1">
    <group-ref>g2</group-ref>
    <group-ref>g3</group-ref>
  </group>
  
  <group name="invalidResources">
    <js>classpath:ro/isdc/wro/maven/plugin/js/invalid.js</js>
  </group>
  
  <group name="undef">
    <js>classpath:ro/isdc/wro/maven/plugin/js/undef.js</js>
  </group>
  
  <group name="wildcard">
    <js>classpath:ro/isdc/wro/maven/plugin/js/**</js>
  </group>

  <group name="g2">
    <js>classpath:ro/isdc/wro/maven/plugin/js/1.js</js>
  </group>
  
  <group name="g3">
    <js>classpath:ro/isdc/wro/maven/plugin/js/2.js</js>
  </group>
  
  <group name="g4">
    <js>classpath:ro/isdc/wro/maven/plugin/js/*.js</js>
  </group>
</groups>
