<?xml version="1.0" encoding="UTF-8"?>
<groups xmlns="http://www.isdc.ro/wro"
  xmlns:xsi="http://www.w3.org/2001/XMLSchema-instance"
  xsi:schemaLocation="http://www.isdc.ro/wro wro.xsd">

  <group name="g1">
    <group-ref>g2</group-ref>
    <group-ref>g3</group-ref>
  </group>

  <group name="g2">
    <css>classpath:ro/isdc/wro/http/1.css</css>
  </group>
  
  <group name="g3">
    <css>classpath:ro/isdc/wro/http/2.css</css>
  </group>
</groups>
