<?xml version="1.0" encoding="UTF-8"?>
<groups xmlns="http://www.isdc.ro/wro"
  xmlns:xsi="http://www.w3.org/2001/XMLSchema-instance"
  xsi:schemaLocation="http://www.isdc.ro/wro wro.xsd">

  <group name="all">
  	<js>/asset/js/**.js</js>
    <css>/asset/**.css</css>
    <group-ref>syntaxHighlighter</group-ref>
  </group>
  
  <group name="syntaxHighlighter">
  	<js>/asset/syntaxHighlighter/**.js</js>
    <css>/asset/syntaxHighlighter/styles/shCore.css</css>
    <css>/asset/syntaxHighlighter/styles/shCoreDefault.css</css>
  </group>
</groups>
