<?xml version="1.0" encoding="UTF-8"?>
<groups xmlns="http://www.isdc.ro/wro"
  xmlns:xsi="http://www.w3.org/2001/XMLSchema-instance"
  xsi:schemaLocation="http://www.isdc.ro/wro wro.xsd">

  <group name="g1">
    <css>classpath:1.css</css>
  </group>

  <group name="g2">
    <css>/path/to/resource</css>
    <js>/path/to/resource</js>
  </group>
  
  <group name="g3">
    <js>/path/to/resource</js>
    <group-ref>g2</group-ref>
  </group>
</groups>
